微博id,微博正文,原始图片url,微博视频url,发布位置,发布时间,发布工具,点赞数,转发数,评论数
IvHh61IHs,在县城的实体产业一定要小心，不能盲目扩张。 原图,http://wx4.sinaimg.cn/large/94900170ly1gc7mdbcsilj20u02bnqrt.jpg,无,无,2020-02-24 17:29,iPhone 8 Plus,634,12,103
IvHdK3G93,营收过一千万，这个副业真滴牛啤。以后请这些同学们来分享分享自己的故事。 原图,http://wx1.sinaimg.cn/large/94900170ly1gc7m49iqg6j20yi5hrhdt.jpg,无,无,2020-02-24 17:21,iPhone 8 Plus,2055,67,181
IvGviwnN8,看到有人质疑“巫师财经”这个号，别的方面我觉得质疑两句嘛也就过去了，但是质疑他不接广告不建群不可能我就感觉很奇怪了。说这种话的人，还是不了解我们这行。自媒体的名气是可以在现实中变现的，即网上红了之后，可以对接企业用户，去企业里讲，什么都可以讲，你信我自媒体做的专业，我教你怎么做内容，你信我财经专业，我帮你做行研，理财，投资，财务咨询，战略咨询。出书，演讲，服务企业，不直接服务粉丝，是可以的。比如刘润老师，他至少一半以上的收入，是企业慕名而来，请他去做咨询案的。每个自媒体人的兴趣爱好不一样，有的人就是恨铁不成钢，着急他人，这种人天生适合当培训师，适合开课，打广告，建群，开训练营。有的人对教育没啥兴趣，对商业感兴趣，不想接广告，只想通过名气作为起点，链接到企业用户，这也完全可行——就连我，每个月都要推掉一些企业邀请去的咨询和培训。干嘛要盯着这块不放呢？接广告建群，骂割韭菜收智商税，不接广告建群，骂虚伪，退一万步讲，就算以后接广告了，建群了，也很正常。这个在商业运作里，叫pivot，转型，业务模式转型。到时候还是有一堆人支持“让他恰”，和争先恐后的报课入群，有啥奇怪的。                原图                            ,http://wx2.sinaimg.cn/large/94900170gy1gc7j1e3q8mj20cb0cc0sw.jpg,无,无,2020-02-24 15:32,微博 weibo.com,1027,65,136
IvGqWrSUe,#奶爸鸡汤辟谣系列#012刚看到的两个职场鸡汤：公司来了一群应聘者，房间里有个包裹，老板说千万不要打开，然后说有事走了，一群人就在那等，但是有年轻人还是打开了，里面有个纸条，说恭喜你被录用了。这个故事告诉我们，不能拘泥于条条框框，要有勇气突破，敢于尝试。另一个鸡汤：还是老板，让下属年轻人看守一个包裹，说千万不能打开，回来以后问有没有打开，年轻人说确实没打开，老板很高兴，升职加薪了——这个故事告诉我们要诚信。这两个鸡汤，严格来说都有错误，但真实世界里的逻辑，也只能参考第二个，第一个绝对不能参考。老板的包裹盒子到底能不能打开，对于这件事杨修心里有一万句妈卖批要说，他就是打开了一盒酥，然后被曹老板给咔嚓了。老板的盒子，你不打开，他也不会给你升职加薪，但是老板的盒子你打开了，他就真可能咔嚓你了。在职场，员工的主要任务就是听从命令，把事做好，所谓的勇气突破，敢于尝试，是指在老板命令的范围内突破和常识。比如老板说，把我这个盒子包装下，包装的精美一点，你好好发挥，老板就会表扬，但是对明确的指示，老板说不要打开这个盒子，你打开了，下场必然死的很惨。一定要分清楚，先听话，再发挥，而不是不听话，直接发挥。                                ,无,无,无,2020-02-24 15:21,微博 weibo.com,495,35,43
IvGiasE7N,奶爸您好，平时看您微博受益良多，有个关于面试的问题想请教您。我是做技术管理岗位的，之前面试过一家公司，专业面的领导经验丰富，很爱发动连环问，整场面试我都在接受他的提问轰炸，好像想要问到我答不上为止，还好我都勉强回答上了，但还是感觉很被动、压力很大。不知道这是他在对我故意压力面，还是他本人性格就这么强势。最后offer是拿到了。请问在这种面试中应该采取什么方式夺回主动权呢？对这种刨根问底的面试官用什么回答策略比较合适？答：这是压力面的一种文明使用方式。我自己就喜欢用这个方式，因为可以有效监测出面试者的真实水平。最好的应对方式就是不要夺回主动权，没有意义。对所有问题都勉强回答上了，就是最好的应对策略。换我，我就会给你打100昏，招为心腹爱将。你看，offer你不也是拿到了么。以后习惯了就好，多试几次，习惯了就好，说不定你会爱上这种见招拆招的感觉。而且相处下来你会发现，像我等这种强势的工作狂领导，也有可爱的地方，对工作的进步和提升，带来的效果绝对不一般。而且这种领导一般升的比较快，跟着ta你升的也快，这个倒不是自吹。而是我发现领导的精力放在哪里，决定了他未来的前途。如果ta的精力放在权术，找存在感上，故意刁难下属，享受吹捧感，基本没前途，如果ta的精力放在技术，业务，工作问题上，越是精益求精，咄咄逼人，ta的前途越广大。                原图                            ,http://wx4.sinaimg.cn/large/94900170gy1gc7i1fgn3wj21h40u0kjl.jpg,无,无,2020-02-24 14:59,微博 weibo.com,471,56,31
IvG4osP7K,#奶爸鸡汤辟谣系列#011“三十岁做不到职场中层就没戏了”本句话，基本为真，不算制造焦虑，只算陈述事实。打工就是这么个玩意儿，基本常识up or out，而且判定人的能力素质，是严格和人的年龄相关的。30总监是最吃香的，40总监就嫌年纪大了——总监已经不是中层管理者了，而是高层。45当不到副总，基本此生无望。50不成总裁，这辈子绝对再无可能。张勇——2015年5月接任阿里巴巴集团首席执行官，1972年出生，43岁，一人之下万人之上，高不可言。大家可以掂量下自己，思考下43岁你能在什么地方。如果到了30-40岁，仍然是基层打工的，连主管都没当上，那怎么办。第一批清退的对象，肯定的，没有例外。所以应该怎么办？要么就不要打工。考个编制，要么就不要打工时间太长，当个主管，经理，有机会加入初创工作，或者自己创业做生意，就想办法试试——张勇就是走这条路，严格来讲他并不是打工仔，而是在外企快要做到合伙人的时候，加入了初创的上升型公司。一直在大公司里打工也行，但是一定要记住：广结善缘。人脉是你的降落伞，这非常非常重要。哪怕你升不了职，被裁员的时候，别的公司有你的哥们，帮你推荐下，你也能上岗。在职场工作5年以上，找工作居然还要投递简历，说实话，是一定要引起反思和重视的。在职场工作10年以上，找工作居然不是朋友介绍，还要投递简历，那真的是loser，这时候找工作会非常艰难。一定要记住，这几条安全底线。1，考个编制，不给企业打工，2，不要打工太久，不要追随标准，想办法自己创造标准，或者加入他人的队伍一起创造标准，3，广结善缘。尤其是3，不论你选择哪条路，3都是绝对的百分百重点，听我的你只会受益，绝不会后悔。祝大家早日搭上职场直升机。                原图                            ,http://wx3.sinaimg.cn/large/94900170gy1gc7h23xs72j21hc0twe2d.jpg,无,无,2020-02-24 14:25,微博 weibo.com,990,311,216
IvFXNgrDg,#奶爸鸡汤辟谣系列#010为什么现在的员工都不怕老板了？都喜欢跳槽？是因为互联网扩散了一个人的能力吗？可以找到各种赚钱方法？可以开滴滴，做代驾，送外卖，搞快递，卖面膜吗？可以一个月赚一万八吗？不是，重复性无增值劳动对于大部分人的吸引力还是小的，再说干这些也不太可能赚到一万八。真实原因在这里：为什么现在都说95后喜欢跳槽，不好管？大家注意到没有，其实说员工喜欢跳槽不好管，很早以前就有了，不是新鲜事。稍早以前是说90后喜欢跳槽不好管，再早是说85后喜欢跳槽不好管，最早是说80后喜欢跳槽不好管，可见喜欢跳槽并不是xx后的通病特点，而是只要年轻，就会这样。因为年轻，有资本啊，现在大部分家庭父母的收入都提高，可以支撑小孩啊，当然希望多试试。年纪大了，就不敢了，并不是他们找到了喜欢的工作，人生安定下来，有了稳定事业。而是他们结婚了，生子了，生活的压力陡然变大了，不仅没有储蓄，甚至都要背负着大笔的贷款。所以只能敢怒不敢言，默默忍受。那么对企业家的启发是什么？两点：1，要么就招有经验的成熟员工，他们稳定性强，但是技能高，对薪水的期待值也高，企业主需要明白这点，要么打造商业模式，要么学会拿高额融资，2，要么就改善自己的企业氛围，建设自己的企业文化，打造团队，建立一套上进的，积极进取的，互相平等的，氛围宽松的，有干货有技术的公司制度，吸引年轻人，哪怕低薪也干的开心。煽动焦虑也讲究技巧，那什么互联网时代到了，员工能赚钱不听话了，没啥用，企业主不信，普通员工也不信。用上面的案例，可以有效做到：来，我这里有一套教你如何创业的课程，拿融资，挑合伙人，找商业模式，顶层设计，只要八万八千八百八，良心价，赶紧来买！来，我这里有一天企业内部管理课程，教你如何打造团队，建立企业制度，只要八千八百八十八，良心价，赶紧来买！来，我这里有一套理财职场课，教你如何有恃无恐，财务自由，事业自由，不用在职场上受气。中型企业主，小型企业主，大龄员工，职场新人。全部都收割到位了，经韭不息，历韭弥坚。这才是正确姿势。                原图                            ,http://wx4.sinaimg.cn/large/94900170gy1gc7gl5ypt1j20ia0ia1aj.jpg,无,无,2020-02-24 14:09,微博 weibo.com,397,57,42
IvFRelinn,这两天按照奶爸的视频在做简历，想请问大家，应届生有必要把一两个月的这种寒暑假兼职经历写在简历里吗？答：做简历分成大简历和小简历的区别：大简历就是不管页数，不管目标，把你所有拿得出手的，全部都详细包装，一一列举。小简历是指你新建几个文档，按照求职目标，把格式排好，然后把大简历里面，相关的经历复制粘贴过来。形成数个有针对性的简历。所以做简历的正确姿势是：大简历，不论目的，事无巨细，3-5页。小简历，精心编排，复制粘贴调整，1页                                ,无,无,无,2020-02-24 13:53,微博 weibo.com,580,110,67
IvFMKzS7x,这个有点触及我9年制义务教育的盲区了，想请各位网友求证下，真的做过司机和代驾的。真能赚到每个月一万八吗？ [组图共11张]原图,"http://ww1.sinaimg.cn/large/94900170ly1gc7fs1tthuj21pc0yi1l1.jpg,http://ww3.sinaimg.cn/large/94900170ly1gc7fs3t9opj21pc0yi7wm.jpg,http://ww4.sinaimg.cn/large/94900170ly1gc7fs5skg2j21pc0yix6t.jpg,http://ww3.sinaimg.cn/large/94900170ly1gc7fs7mg26j21pc0yi1l2.jpg,http://ww2.sinaimg.cn/large/94900170ly1gc7fs9lt75j21pc0yi4qu.jpg,http://ww2.sinaimg.cn/large/94900170ly1gc7fsbyboej21pc0yiqv9.jpg,http://ww4.sinaimg.cn/large/94900170ly1gc7fsfandoj21pc0yi7wm.jpg,http://ww3.sinaimg.cn/large/94900170ly1gc7fsgrjt7j21pc0yi4qu.jpg,http://ww4.sinaimg.cn/large/94900170ly1gc7fsib45mj21pc0yihdy.jpg,http://ww2.sinaimg.cn/large/94900170ly1gc7fsk1p17j21pc0yix6t.jpg,http://ww4.sinaimg.cn/large/94900170ly1gc7frz4ovwj21pc0yi1l2.jpg",无,无,2020-02-24 13:42,iPhone 8 Plus,536,9,201
IvFDwwzPy,#奶爸鸡汤辟谣系列# 009本条辟谣由热心网友代劳——图1-4为谣言部分，图5为辟谣部分。另外稍微有点脑子的人都知道现在有收入的人是体制内人员，按时发放工资，社会不是在不断加速，而是变得更加保守，编制内工作将会越来越热门，疫情结束后报考人数将会迎来近几年的最高峰值。 [组图共5张]原图,"http://ww4.sinaimg.cn/large/94900170ly1gc7f2gtmxpj20yi1pcwly.jpg,http://ww2.sinaimg.cn/large/94900170ly1gc7f2h2gyhj20yi1pc106.jpg,http://ww2.sinaimg.cn/large/94900170ly1gc7f2haqvoj20yi1pc45i.jpg,http://ww1.sinaimg.cn/large/94900170ly1gc7f2hhwqvj20yi1pc105.jpg,http://ww1.sinaimg.cn/large/94900170ly1gc7f7int0sj20yi5y0qv6.jpg",无,无,2020-02-24 13:19,iPhone 8 Plus,471,86,152
IvFwNiU9s,下一阶段重点写于丹和陈果老师的鸡汤，倒不是说辟谣，而是纠正。纠正的重点在两方面：1，是否符合逻辑，大部分鸡汤都不符合逻辑，2，是否符合现实中的常识，这是大部分鸡汤最毒害的地方，枉顾现实世界里的基本细节和可能产生的恶劣后果，没有基本的推理和预判能力，上下两张嘴皮子一翻说话特轻松，但是学生一旦去实践运用，就会产生恶劣甚至惨烈的后果。说误人子弟都是轻的。比如陈果老师鼓励学生事无巨细什么样的坏事都要向父母坦诚——她的父母都是高知，文化人。但我们的父母，都带有历史的局限性，和父母保持表面的和谐就够了，本来就不应该坦诚也绝对不能坦诚，否则会惹来大祸害，对你的人生，工作，事业，情感，婚姻和生活造成无穷无尽的烦恼。                                ,无,无,无,2020-02-24 13:03,微博 weibo.com,692,55,100
IvFoQ60Fa,#奶爸鸡汤辟谣系列# 008“这个世界上没有卖不出去的东西，只有蹩脚的推销员。”本条为假。希望大家不要神化销售人员。2C产品领域主要看品牌和设计，2B产品领域主要看技术和质量。这是所有销售员都必须承认的常识。2C就是卖给消费者，普通大众的，2B就是卖给大公司的，政府和企业单位的，所以这个世界上真的存在卖不出去的东西。如果你想打造一款新的洗发水，把宝洁联合利华PK下去，你用一支销售铁军，疯狂扫楼，扫超市，去和每家超市的老板谈，推销。你这么做，铁定完蛋，不可能卖出去的，没人信，哪怕超市老板购入了，放货架也不会有人买。正确的做法是什么？应该先开个淘宝店，找个设计师，把产品的瓶子包装设计好看点，取个好听的名字，然后联系10-100个美妆小博主，帮他们多想几个好的营销故事，什么哈佛博士退学只为了解决中国人头皮问题，什么日本匠人精神一辈子只生产一款洗发水纯天然无添加之类的，让ta们录视频给你推，引流到淘宝，瞬间就带起来，比如找推销员有太多了。2B这个技术难度比较大，涉及到专利，科研，高精尖，不是我擅长领域，比如马斯克的销售人员再牛逼，如果他的运载火箭技术不行质量不行，美国政府航天局会愿意购买？只说说我懂的：2B领域，品牌的影响也是很大的。比如说卖交换机，联想华为的交换机，其实跟IBM的没有任何区别，设计，技术，质量，其实中国人的和老外的区别不大，而且中国人卖的更便宜。但是各级省市政府在采购的时候，都认准了IBM不放，不敢买联想华为的。为啥？怕担责任。这玩意儿买回来，没故障还好，当然没故障也不可能有人表扬你。一旦出现了故障，上头肯定问责采购，为什么买这家品牌的？如果采购买的IBM，那可以理直气壮的说：哦我买的IBM，是业内最好的了，人类科技就这个水平，我也没办法。但如果采购买的联想华为，那就完了，老大一定会问：这是不是业内最好的？为什么不是业内最好的IBM的？是不是因为价格便宜？买价格便宜的货是不是因为你吃回扣了？你看，这就是品牌的力量——这一点让当年联想华为的投标和销售人员颇为头疼，最厉害最金牌的销售也非常头疼。还好，祖国强大了，华为开始也腾飞了，5G开始我们垄断，什么机器都应该买我们中国制造，IBM这种货色注定要被扫进历史的垃圾堆里，我由衷的自豪。                原图                            ,http://wx1.sinaimg.cn/large/94900170gy1gc7e3avlv6j20hk0hkn90.jpg,无,无,2020-02-24 12:43,微博 weibo.com,1224,169,106
IvFhA3Dxh,混事业还需要向大家科普一个重要常识：学历不好的人，不要试图混成大企业高管。倒不是说这绝对不可能，也有可能。但就算你学历很高，一水清华，我也不推荐你努力朝高管进发。太可惜了，总觉得有点浪费。名牌大学里的优秀毕业生代表，绝对不是什么XX大公司总裁，XX公司大总监之类的角色，不够分量。张一鸣，王兴这类人，才够分量。努力争做创造者creator，而不是追随者follower，这很重要。学历低的人就更不用说了，能力不太行，那就努力考个编制，能力强，混成个小经理也就够了，然后努力找机会，自己干，自己做生意。这比你最终晋升到高层的可能性，还要更大一些。当然如果不想晋升，只想稳定，那么就不要在企业领域混——考个编制。                                ,无,无,无,2020-02-24 12:25,微博 weibo.com,1010,139,208
IvF3fgHfq,第一印象定律，你给别人留下的第一印象，很难改，基本定型，你越努力对方越讨厌你。当然也不是完全没可能，改变第一印象的方法就是断舍离，慢慢断了联系，舍得离开，超过100天以上没有任何交流，然后突然出现，约来试试，这样重启，可能性更高一点。但要打听清楚他这段时间有没有新女友，得认命 原图,http://wx2.sinaimg.cn/large/94900170ly1gc7chh48vcj20u01hcgxl.jpg,无,无,2020-02-24 11:50,iPhone 8 Plus,898,79,105
IvEZxE7V4,一个是要学会上班摸鱼偷懒，抓紧时间小憩，努力锻炼身体健身。一个就是考个编制算了。另外这个top5房企大概率是碧桂园，入职门槛低，工作效率慢，工作氛围差，基层领导素质能力平庸，企业管理混乱，完全靠注水臃肿号称所谓前几，跟苏宁一路货色，业内精快强的企业没人瞧得起它。 原图,http://wx4.sinaimg.cn/large/94900170ly1gc7c5slwxtj20x00u0135.jpg,无,无,2020-02-24 11:41,iPhone 8 Plus,993,55,198
IvELjhWIK,当一个人对社会和企业的了解几乎全部都是来自国产电视剧和幻想时，说明这个人大学基本全部白给，完全在浪费时间和梦游，学习和社会实践都很糟糕，属于上中下的下层尾巴学生。在这种情况下，建议多找几份实习干干了解了解，多阅读商业类书籍（我们微博就有大量真实案例），进行真实的了解之后再作决定。不了解也行，那就全盘听家里的，不要相信自己的所谓“判断”，你没判断，只有幻想。                原图                            ,http://wx1.sinaimg.cn/large/94900170ly1gc7b6tm8igj20yi2j8tvc.jpg,无,无,2020-02-24 11:06,iPhone 8 Plus,1550,67,221
IvEmyxqCu,"#奶爸鸡汤辟谣系列#007如果你觉得你的公司不好你应该去建设他而不是抱怨它。本条鸡汤为假。这个话题涉及一定的敏感性，为了安全着想，请大家评论时候，把话题严格局限在商业和公司场合，不要盲目往外扩展。而且我的经验主要也是在商圈居多，别的我一窍不通。所有的公司，说白了，都是一个利益集体。一个利益集体中，每个人的工作都是明确分工定位好的，最基础的就是两类工作：做决策，做执行。每个人都是同时做这两件事，只是侧重点不同，还有权限不同。有的人只能对自己的日常小事的次序和方法做决策，有的人负责小部门工作的安排小决策，有的人负责整个部门的业绩目标考核中决策，有的人则负责整个公司的方向和重点，大决策。全世界所有一流的商学院顾问和咨询顾问，甚至不用一流，只要稍微具有一丁点常识的，都会告诉你，决定一家公司命运的，永远是决策，而不是执行。目前全世界好像还不存在任何一家公司的死亡，是因为执行做的差。ofo的死亡不是因为员工不认真干活，而是因为接受融资时乱给veto right以及怎样都找不到合适的盈利方式——决策问题，巨人大厦的负债是不是因为员工不认真干活，而是当年决定盲目扩张——决策问题，九城的倒闭不是因为员工不认真干活，而是因为当年CEO错误的估计了代理和自研的关系问题，盲目得罪暴雪，导致外部恶性竞争（丁磊参了一脚吃的满嘴流油）——还是决策问题。这里还有一个问题就是，其实大部分公司的飞黄腾达，也和执行没太大关系，主要还是跟决策有关系：IBM当年濒临倒闭，第一时间找了郭士纳当CEO，很快扭亏为盈——决策问题，巨人后来重新腾飞，是因为给自家网游找到了新型的商业模式——决策问题，联想的起势和下跌平庸，说白了就一个区别，掌门人换了——还是决策问题。一家公司的团队战斗力固然很重要，没得说。但是决策层的个人能力和眼光，彻底决定了整个公司的生死，具有真正关键性的不可替代的作用，必须要负起全部责任。想当美国第一位女总统的女孩卡莉·菲奥莉娜，在位没几年，把惠普从世界第三搞成了300开外，就是因为她为了拉拢股东，忽略长久利益只顾眼前，卖掉了优质资产，收购了庞大臃肿的劣质资产——决策问题，微软的前CEO史蒂夫鲍尔默，下台后股价飙升（一般CEO下台公司股价都会跌），干了几年老大惹得人神共愤，李开复亲自跑知乎去骂他，因为这个人的眼光真的很牛逼，成功的新兴公司一家不投，看好了收购投资的，基本买谁谁死——还是决策问题。这两个人都因为他们的错误，付出了下台的代价。现任的微软CEO，根据新闻来说干的还不错——他和鲍尔默在位的时候，公司的执行团队其实没什么变化，为什么局面截然不同？还是决策问题。所以如果你觉得你的公司不好你应该去建设他而不是抱怨它。这是一条伪命题。如果公司真的不好，说明在决策层面出现了严重问题，也就是说，决策层下达给执行团队的命令都是错的。这个时候，员工越是努力工作，公司朝着灭亡的速度就越快，譬如当年的惠普。这个逻辑最早其实是源自肯尼迪总统的那句话：Ask not what your country can do for you, ask what you can do for your country.原初的逻辑是对的，就是不要总想着社会来照顾你，你要多给社会贡献价值啊之类的。但是引申过来，觉得XX不好，不要管，不要问，埋头瞎建设就完事儿了，这个逻辑就是错的，而且逻辑重点被转移了。前者的逻辑重点是谈贡献价值，后者的逻辑重点不是谈贡献价值，而是谈忽略原因。可原因不能忽略，一旦忽略，越是努力贡献，灭亡的就越快。因此：不要老是斤斤计较薪水有多少，前景好不好，多想想自己有多少能力，能贡献多大价值——这是对的√如果你觉得你的公司不好你应该去建设他而不是抱怨它——这是错的×                原图                            ",http://wx2.sinaimg.cn/large/94900170gy1gc6wen6e70j20xc0irk7q.jpg,无,无,2020-02-24 10:05,微博 weibo.com,1206,264,132
IvAbGxKaP,求问大家推荐一些口味比较清淡的美食博主，比如粤菜、淮扬菜、鲁菜之类的美食博主，可以是吃播，探店，也可以是烹饪厨艺教程的。如果不是个人视频博主，美食节目视频也可以哈，想看看，感激！王刚师傅很好，但他做的菜都偏辣，希望能找到类似他，但是教清淡口味菜的博主，感激只要视频的up主/和博主哈，看图文根本学不会。                                ,无,无,无,2020-02-23 23:27,微博 weibo.com,1439,267,475
IvzmJqNJg,颜值高在职场是劣势不是优势已经是一条常识了。男领导想肏死你女领导想弄死你。很抱歉，这就是个残酷的等级社会，上级对下级就是压迫，不好看最多压迫劳动力，好看的那还要压榨你的性资源。所以中性化职业化打扮不显山不露水当然是最好的，不要超过上司也是基本要求。廉价套装长裤是最好的。 原图,http://wx1.sinaimg.cn/large/94900170ly1gc6nft51zzj20yi0etwjt.jpg,无,无,2020-02-23 21:21,iPhone 8 Plus,3740,300,609
Ivzkdbqq3,人生有三样东西最有害，分别是：排名，攀比，和评选。 [组图共2张]原图,"http://ww2.sinaimg.cn/large/94900170ly1gc6n7nw6j8j20u01hc4hw.jpg,http://ww4.sinaimg.cn/large/94900170ly1gc6n7ocrezj20u00gvmzm.jpg",无,无,2020-02-23 21:15,iPhone 8 Plus,901,228,95
