微博id,微博正文,原始图片url,微博视频url,发布位置,发布时间,发布工具,点赞数,转发数,评论数
IwtV9phAc,别人勾搭领导，我们敢怒不敢言，不知道怎么办，轮到自己和领导有点私交，同事们立刻风言风语，团队都孤立我，还是不知道怎么办。到头来倒霉的还是自己，到底该怎么办呢？唉 原图,http://wx1.sinaimg.cn/large/94900170ly1gcdl2uw77vj20yi0c941x.jpg,无,无,2020-02-29 21:20,iPhone 8 Plus,2,0,0
微博id,微博正文,原始图片url,微博视频url,发布位置,发布时间,发布工具,点赞数,转发数,评论数
IwtV9phAc,别人勾搭领导，我们敢怒不敢言，不知道怎么办，轮到自己和领导有点私交，同事们立刻风言风语，团队都孤立我，还是不知道怎么办。到头来倒霉的还是自己，到底该怎么办呢？唉 原图,http://wx1.sinaimg.cn/large/94900170ly1gcdl2uw77vj20yi0c941x.jpg,无,无,2020-02-29 21:20,iPhone 8 Plus,50,3,16
IwtlFq24I,做事靠谱是最可贵的品质。一个人大凡能做点成绩，都能说明他有做事靠谱的习惯。很多来信提问的同学，都喜欢说自己的规划，打算，想法，这些其实都只是“想”，却很少有人会提到“做”。良好的自律性和强大的执行力，知道如何在团队中与人配合，这些素质就是做。只有“想”，没有“做”，其实一辈子都无法真判断初自己的想法到底对不对。先开始做，有了行动，才能验证，问别人意见，求如何评价自己的想法，这种其实真的给不出意见，也给不出评价。                原图                            ,http://wx2.sinaimg.cn/large/94900170gy1gcdim21dpxj20pb0pbh5o.jpg,无,无,2020-02-29 19:52,微博 weibo.com,309,69,50
Iwt8z9nWX,入不敷出就别想着安稳上班了，车别开了骑车或者公交上下班，老公出去跑滴滴，自己收入干着，如果有学历的话，挂在家教中心下班了去做家教，或者找美甲美容店之类的兼职。都入不敷出了还想着开车上下班，看书学习，都不瞎胡闹嘛。 原图,http://wx4.sinaimg.cn/large/94900170ly1gcdhlnpxl2j20yi2yinpe.jpg,无,无,2020-02-29 19:20,iPhone 8 Plus,799,16,93
IwstTo9Ua,知乎上有一个问题，真的有一生顺利没有吃过苦难的人么？没有，不存在。这个问题的性质类似：正义可能迟到，但永远不会缺席。吃苦卖力也是一个道理。而且一定要记住。迟到比早到，对人的摧残更厉害，人越受苦。普通小公务员，做事消极怠工，被领导批评，骂了几次，不敢渎职了，以后兢兢业业。小公务员时候不认真做事，擅长拍马屁有后台，升职了，20年后当局长了，随便搞豆腐渣工程，出事了，坐牢。前者的正义到来，只是挨骂几顿，后果很小，后者的正义到来，那时候的小公务员，以后老婆孩子都有了，孩子可能都读大学了，自己身体也不行了，可能当天晚上就脑溢血，头发白了一半，财产全部没收，老婆改嫁，孩子退学。家破人亡，后果极为严重。吃苦这件事也是一个道理。小时候挫折多些，心志坚定，长大了再遇到类似的事情，总能坦然自若，大一时候苦些，毕业时候总要轻松一点，更自如一点，刚毕业时候苦些，人到中年了总要轻松一点，怕就怕：从小娇生惯养一帆风顺，长大了遇到一点小事，立刻精神崩溃，大一时候洗澡舒舒服服，大四了要把洗澡水喝下苦不堪言，刚毕业时候啃老好吃懒做，到了中年父母离世家境中落，一下颓唐，整个人变的不人不鬼。未雨绸缪，早做准备，抗击风险。                原图                            ,http://wx4.sinaimg.cn/large/94900170gy1gcdes6xapjj20b40b4wkv.jpg,无,无,2020-02-29 17:40,微博 weibo.com,904,140,163
IwsnT5Sb3,下属遇到工作困难，一定要及时的跟上司谈，哪怕上司脸色不好，骂人，也一定要坚持。这个沟通过程，就叫搞定上司。学会这点的下属，才能和上司如鱼得水，才能有前途。具体的沟通方法，就是正式话术：我需要您的support——这是外企，有些事情需要跟您请教——这是私企。 ,无,无,无,2020-02-29 17:25,微博 weibo.com,936,222,112
IwshMgrj9,#奶爸鸡汤辟谣系列# 029奶爸，关注您很久了，最近在看您写的反鸡汤系列。很喜欢，真知灼见。想问下，我们办公室墙上挂着的：“诸葛亮从来不问刘备，为什么我们的箭那么少？关羽从来不问刘备，为什么我们的士兵那么少？张飞从来不问刘备，兵临城下我该怎么办？于是一一有了草船借箭、有了过五斩六将、有了据水断桥吓退曹兵……如果一切准备就绪，还需要你干什么。”这算鸡汤吗？算鸡汤，而且是不正确的鸡汤。刘备还在的时候，手下人的职位是这样的：关羽大于诸葛亮大于张飞。刘备是主帅，关羽是副帅，刘备如果要出去打仗，基本都是关羽全权负责一切事宜，要派人出去打仗，肯定也是关羽牵头。张飞是大将，但不能当帅，曾经也给他机会让他在徐州守城，结果被吕布偷袭，城丢了，这事之后，张飞的地位一直都要低关羽一头，属于犯过重大错误的干部，重新任用。诸葛亮一开始没到大家想的那么重要的地位，军政一体，全权负责。那是刘备死了之后，刘备还活着的时候，主要让他负责战略和后勤。这样的公司分配，用人策略，是很合理的。所以确实不应该是诸葛亮、关羽、和张飞跟刘备要箭要兵要人。应该是反过来，刘备朝他们要。军队缺箭了，要问管后勤的诸葛亮，小亮啊，前方箭不够了，想办法调度下，帮帮忙，军队缺人了，要问管练兵的副帅关羽：老关啊，兵练的咋样啦？啥时候能用啊，咱们要扩充人啊。出门打仗，留张飞守城，要问负责守城的张飞：阿飞啊，考考你，万一有人偷袭，咋办啊，你要如何如何呀，叮嘱到位，这个职场逻辑是反过来的，老板要用人不疑，疑人不用，而且要擅长用人。员工如果不经常问老板，不跟老板交流，老板对手下的工作一无所知，公司就完蛋了，员工要经常和老板沟通，老板也要经常和员工交流，了解员工一线工作的实际，公司才能蓬勃发展。话说回来，张飞确实没问过刘备兵临城下我该怎么办？所以徐州失守了，被吕布偷袭。徐州在刘备的创业历史上，是至关重要的，称得上是白手起家的第一桶金，好不容易慢慢发展了，结果被吕布摆了一道，而且吕布还是刘备收留的，驻扎在小沛，徐州失守后，刘备只能窝囊的去小沛驻扎，被袁术明着欺负，这件事更导致了吕布后来膨胀跟曹操硬刚，最后白门楼被活捉，当时刘备已经投奔曹操，成了一位谋士，曹操问吕布投降要不要收他，这人天下无敌好牛逼的，刘备说这人该杀，难道你忘了丁原董卓？所以吕布临死前说了五个字“大耳贼害我！”你看，这一切的悲剧，都源自这句话：张飞从来不问刘备，兵临城下我该怎么办？你说编这鸡汤的人，心眼黑不黑吧。。。为吕布叹气，死的冤~                原图                            ,http://wx3.sinaimg.cn/large/94900170gy1gcddx4cao7j21hc0u0hdt.jpg,无,无,2020-02-29 17:10,微博 weibo.com,199,38,23
IwrAw8Fyn,奶爸，你好。麻烦厚。女朋友很胖，大概130多，有希望瘦下来吗？随着年龄的增长，男人对女人的身材是怎么看待的？会因为女人身材不好而出轨的概率增大吗？盼复，勿喷答：慢碳减肥法，是绝对可以健康稳定的瘦下来的，而且可以作为终身坚持的习惯。一开始慢一点无所谓，只要坚持住一个月瘦5-10斤都不是啥问题，坚持3个月就能成功。所谓的慢碳减肥法，非常简单，就是替换主食。平时吃米饭，面条，用别的慢碳主食换掉即可。比如中午必须吃满满一碗米饭才饱，那就把米饭换成山药，同样体积的山药，热量至少低了一半，但是吃起来饱腹感是一模一样的。别的菜，肉，照常吃，别放太多油和盐即可。这个方法非常简单，但是普通人没法坚持，难点主要有2：1，自己做饭很麻烦，难以坚持，2，口感不适应，一开始把米饭换成山药，土豆，不习惯。2很好解决，把菜做的美味可口一些，好吃一点，慢慢适应山药土豆的口感，吃一段时间就习惯了。广泛使用大米作为主食的国家，在全世界范围内其实是不多的，很多地方的人都不习惯吃米饭，他们吃豆类和土豆作为主食，千百年来身体健康和营养都没出现过问题，所以中国人换主食，根本不必杞人忧天。1就比较麻烦，最好的解决方法就是，你帮忙做。只要是吃现成饭，饭来张口，有人带着自己运动，把生活习惯变成健康的，瘦的，性感美女的生活习惯。那么你媳妇很快也会变成性感美女。这叫习惯养成。另：主食还可以变成紫薯，红薯，白薯等薯类，豆类比如鹰嘴豆啥的也成，但是豆类吃多了胃不舒服，我还是选择山药，土豆，薯类，尤其是山药，真是减肥利器。图是我自己做的午饭，可以供你在做菜方法和具体使用分量做参考。卖相不好，但是味道不错，春节回家，没法运动，我又瘦了3斤。（山药我都是盛堆尖满满一碗，图中是吃了一半）                原图                            ,http://wx3.sinaimg.cn/large/94900170gy1gcdavzap0gj21400u0n3y.jpg,无,无,2020-02-29 15:24,微博 weibo.com,2622,262,599
Iwrp67iK3,另外找漂亮媳妇就不能指望她做家务，这是个常识了其实。因为漂亮和做家务是互斥的，不存在兼容。抗衰老，需要花钱精心打理，做家务为生活操劳担心，会加速衰老这个过程。如果你就是颜控，就想娶漂亮老婆，那娶回家就必须得想尽办法让她保持美貌，那么老婆必然是过着养尊处优的生活的。指望老婆漂亮，工作强能赚钱，这个也还好。同时要求老婆崇拜，温柔，性格好，贤惠，做家务。这个是百分百完全不可能的，幼稚小男生的想法。稍微成熟一点的男性，其实都明白这点。比较实际一点而且比较常见的，就是老婆漂亮，性格好，给情绪价值，善解人意，但是不干活，家务活你做或者请钟点工，工不工作随缘。注意，这不是什么女拳，什么思想，什么号召，什么提议。这是我真实的见闻和经验，属于社会事实。我只提供事实，不提供观点。越早接受这个事实的男生，找到漂亮老婆的概率越大。                                ,无,无,无,2020-02-29 14:55,微博 weibo.com,4264,577,552
IwrkU5DiJ,谈恋爱择偶，不论男女一定要明白一个常识，就是要求高，还容易找，要求多，就很难找到合适的。某一方面90分，其它方面60分，这种人真实存在，所有方面都70分，这种人基本不可能存在。截图里的案例要求对象同时具备四点：1，外形好2，有稳定工作，3，贤惠做家务，4，本科学历以上。他还纳闷自己村里的同龄人，娶得老婆都漂亮贤惠，为什么自己不行？因为谈恋爱这种事，最多只能要求两点，别的不能要求太多了。村里人娶媳妇，基本是没有本科学历也没有稳定工作的，就漂亮，做家务。而且我也是农村人，不知道为啥我的感觉和这人完全不同。一般娶漂亮媳妇，不仅不要求她工作，连家务活都不让做，现在村里家家户户都这样。具备这四样，不存在这种人。而且这个题主，也没有达到每一样都70分。他的所谓性格，不抽烟不喝酒有房，性格温和，就算都达到70分了吧，但是1，外形，估计最多60分，他却想要找外形90分的女孩，2，不爱做家务，这方面0分，却要求找个90分的贤惠女孩，3，钱不多，收入不高，算50分吧，4，家境差，严重拖累，最多20分。这个基本不太可能。女找男其实也是同样一个道理。各方面都要求70分，是非常非常难的。某一个点要求90分，别的五六十分过得去就行，倒是有可能。但就得看你能否接受和包容了。注意，择偶标准，一定是：要高，不要多。不多的那些部分，想办法磨合，能磨合就处，不能磨合就算。                原图                            ,http://wx2.sinaimg.cn/large/94900170gy1gcd9prg384j20u03kx7t5.jpg,无,无,2020-02-29 14:45,微博 weibo.com,5801,184,585
IwrduiZqB,挺好，加油！ 原图,http://wx1.sinaimg.cn/large/94900170ly1gcd977sld1j20u01hcqj3.jpg,无,无,2020-02-29 14:27,iPhone 8 Plus,675,8,76
IwqnamkDr,自我意识过剩是大部分人的通病，本质上所有人都是既自大又自卑的，都无时无刻不在乎自己的存在感。但这个世界上，以人而有权势，基本是不可能的。所有权势，都是以事而有存在感和权势。哪怕生下来，地位权势就远高于人的二三代，一旦事情做差，都会沦为笑柄，甚至失去原本的存在感影响力。他们想要有存在感，也得不断成事。而自我意识这玩意儿，是个魔咒。你在乎它，它会跟着你，你喜欢它，会变的肤浅，愚蠢，你反抗它，会变的阴暗，嫉妒，愚蠢，你刻意掩饰它，会变的敏感，自卑，软弱。只有注意力彻底转移，把自我的评价，他人的评价，各种攀比，转移到具体成事上。我要处理的工作是什么，我要努力完成的任务是什么，我要解决的问题有哪些，哪怕思考宏观，也是：整体流程是什么样，整个行业发展是什么样。这里问题，比以下这些好多了：大家学历都好高，我好自卑，人生有没有瓶颈有没有天花板，我今年23岁，有时想到过去做过的一些事情，现在会觉得无比的沙雕，不喜欢自己，请问一下，这种心理正常吗？以上都是同学们提问的真实问题。为什么会有后者的想法？1，手头的事情没做好，逃避，不想解决，喜欢思考宏大，觉得自己厉害，沉迷错觉不愿醒来，2，无所事事，吃饱了撑的没事干，胡思乱想。                原图                            ,http://wx4.sinaimg.cn/large/94900170gy1gcd5h3j7lnj20k00gpwxe.jpg,无,无,2020-02-29 12:18,微博 weibo.com,1186,438,111
IwqcN7IAN,"奶爸您好，我想跟您说一下我的困惑，希望能得到您的指点。我本科英语，硕士法律，然后前段时间应聘到了一家律所实习，做涉外业务，我在团队中资质最差，大家都是名校生或者海龟，不过领导也没放弃我，我也想弥补差距，但是又觉得有种差得太多了不知道从何补起的感觉，没有自信，也就缺乏了干劲儿。。。可是，我也不想就这样放弃自己想做涉外律师的梦想。大概以前的环境都是当""鸡头""的感觉，现在要当""凤尾""，哎，我该如何摆正自己的心态呢?答：年轻人要多务实，少务虚。务实就是集中精力，去完成老板教给自己的工作，努力探索思考分析公司的流程，解决问题，尽快成熟成长起来。务虚就是在乎学校牌子之类无聊的东西。学校牌子很重要，但仅限于求职时候。你都已经进去了，就不存在什么资质太差的问题，没有区别。沉迷在这种虚拟感觉里，说明又自大又自卑，而且不务正业。正业是每天遇到的工作，要高质量完成，要知其然还要知其所以然。不集中精力思考这些，立刻就开始攀比，公司没评比，名校生忙工作，没人在乎你，自己一个人给自己加戏，上赶着去攀比。建议不想好好工作没有自信缺乏了干劲就主动辞职，把机会让给别人，不要浪费宝贵机会和老板。                原图                            ",http://wx3.sinaimg.cn/large/94900170gy1gcd4qhhnukj21h40u0kjl.jpg,无,无,2020-02-29 11:52,微博 weibo.com,567,57,67
IwpNj74jB,#奶爸鸡汤辟谣系列# 028人丑就要多读书，有没有道理？人丑就要多读书，大概的意思有三层：1，多读书，可以帮你赚到钱，2，多读书，可以帮你提升气质，从而把妹，3，多赚钱，可以帮你提升气质，从而把妹。以上三层意思，统统都是狗屁。1，多读书并不能帮你赚到钱，赚钱和读书之间没有线性关系，2，多读书并不能帮你提高气质，气质的提高还是主要靠外形，3，多赚钱可以帮你提高气质，但不是人丑才需要赚钱，人长的漂亮一样需要赚钱。知道自己脸不行，那就在形象上下工夫，多去健身房，学会怎么穿衣服，剪个合适的发型，学会护肤跟打扮，注意坐姿站姿和行走姿态，从自己说话的语气，声调上入手，锻炼自己的发声，注意自己的谈吐等等。有关这个在The Game的第一章还是第二章里，作者Neil Strauss有详细的描述，他的形象一直很糟糕，头发稀疏，五官不够俊朗，身板太过单薄，穿的不够鲜亮，说话语速过快，有的时候语无伦次没法跟人很好的沟通。他为了改变形象做出了很大的努力，花了大半年时间，即便最后从五官上说还是个average looking guy，也就是所谓的6分，但是整体的气势和形象也比以前有大大提升在学习上下的努力和功夫，跟在形象上下的努力和功夫是两件南辕北辙的事，不要把这两件事混为一谈。大部分人都是普通人，不美不丑，在普通的基础上，是可以提升的，日常简单的生活习惯和整洁大方的穿搭就可以提升不少，用不着花太多钱，但也不要妄图靠读书来掩饰自己丑陋的外表，这没屁用。                原图                            ,http://wx2.sinaimg.cn/large/94900170gy1gccgbxsjznj21hc0u0qv5.jpg,无,无,2020-02-29 10:50,微博 weibo.com,695,145,92
IwpMyqzsd,奶爸您好，我有个疑问，就是您指的美女，是漂亮到哪种程度的女孩子。我在上海大学读大一，据我观察身边的同学，大家都蛮好看的，至少是不丑，高中时不算好看的同学通过化妆穿搭也看起来像个小美女。还是说青春女自带三分姿色，现在还没到检验颜值的年龄?如果说判断美女的标准是追求者的质量和数量，我感觉女生个人的能力，层次，涵养对她遇到什么样的追求者发挥着不吝于颜值的作用。（我之前做过一个实验，把自己的无修无p自拍放到虎扑上，然后收到了近300条回复，20多条搭讪私信，100多个陌生人关注，一个相貌平平的女孩子都这个样子，可想而知美女，大美女们生活中会被怎么垂涎，但从引起垂涎到让优质男想要与之共同生活肯定需要很多重要的东西吧。）答：这个就是那句老早的道理，叫“网络防沉迷”。梁静茹的演唱会我去过，万人大场，一万个人把体育馆塞的满满当当，聚光灯一打，那种万众围绕的眩晕感，站在舞台中央，普通人简直可以说是达到了虚荣心的癫狂极致，也就大明星才有足够的定力平息这种浮夸。但是在网上的虚拟世界里，随便什么人都可以享受这种浮夸。你看我右边的关注数字，比梁静茹的万人演唱会的人数还要多一百倍。可我在现实中有梁静茹厉害吗，有她受欢迎吗？恐怕连亿分之一都没有。这一点我还是很清醒的，我明白自己的现实成绩，作品，比如课程，书籍，公司，口碑，还不够，还属于努力奋斗期，而不是收获大成期。但是很多小同学就不是这么想的。因为投稿是女孩，这里只说女孩——在知乎，虎扑这种直男聚集，极度饥渴的地方，任何一个普通人都能吸引到一堆人追求。在微博你精修各种照片，勤奋努力更新，关注数量最多几百。去知乎你随便答个问题爆爆照片，点赞瞬间过万。可回到现实中，又咋样呢？一年新认识的异性数量，恐怕不会超过五个。真实邀约自己的异性，恐怕不会超过3个。不要拿虚拟感觉，来影响自己现实的判断和自我认知。为什么普通人会有自己受欢迎的错觉，会浪费时间思考情情爱爱的问题？因为一方面情情爱爱是人性的弱点，谁都喜欢享受和消费，都不喜欢辛苦创造，另一方面就是社交网络给人造成了自己很受欢迎，很优质，很值钱的错觉，有一种错误的正向反馈，从而忽略了其它更重要的事情，整天就想着什么颜值，优质对象，感情关系这种低价值的玩意儿。可现实是：大部分人就是普通人。普通人就不要妄想着有优质对象来爱自己。更不要妄想着自己改变了，提高了，就有优质对象来爱自己。不如让自己变优质，然后自己爱自己。题主提到的什么能力，层次，涵养确实很重要，但这些东西的目标不是为了让优质男生来爱你，而是赚到钱，有事业，得到权势和地位。年轻人不要整天沉迷情情爱爱，应该爱他妈谁谁，有没有男生追无所谓，拉倒。爱美不是坏事，但不要百分百全部精力都用来爱美，于别的正事就一团浆糊，宛如梦游。至少把7成以上的时间用来忙正事，要集中精力忙正事，努力去追求事业，权势，地位，和影响力，尤其是在大学期间，就要做好准备，我们平时聊职场，聊方法，聊实习，很少有人参与讨论，一旦聊什么颜值，感情这种很低价值的东西，大家就像看见狼吃肉，兴致勃勃，这是非常错误的。这很重要，等你到了30岁，35岁，你会感激我说的这番话。                                ,无,无,无,2020-02-29 10:48,微博 weibo.com,2202,297,168
IwlcaE2QB,啥叫被动收入？就是完全不需要你投入任何时间和精力的，就叫被动收入。从这个意义上来说，炒股不算被动收入，因为你需要精研十年（全职），才能成为一个交易员，之后每天都要阅读大量材料。基金也不算，因为高风险的基金需要你时刻盯着，看信息，各种分析。小风险的基金，就算被动收入，但收入太少了。除非你有一千万，一年4%，40万，但真有一千万，投资房产比这个收益大多了。巴菲特说他不懂炒股，从某种意义上来说确实是对的。因为他的伯克希尔－哈撒韦公司，是世界上最大的保险公司。整个工资自运转。从销售，产品研发，后台研发，投资交易，都有团队在做，每个团队各个级别都有高手在管，一层层向上负责，他基本不用坐班，天天到处游玩，旅游，钱也源源不断进账。他的老朋友比尔盖茨，也是一样，微软CEO都换了两任了，别人996别人干去，我爽了。‘马云也是一个道理。马化腾家族每年更是能有个百亿的现金进账，他们的收入组合非常简单，腾讯的分红+股票的套现，然后投资到房产上去——众所周知马喜欢去香港买别墅。因此除了房产外，把自己的事业做大，让其自运转，确实是最好的被动收入。这个就给创业者提出了一个非常严峻的问题：你的公司是否可以自运转。不能自运转，就永远不算财富自由。举个简单例子，我每天都要在微博更新，是因为我的事业就无法自运转。我仍然需要投入大量的时间精力，才能维持关注的增长。想解决这个方法也简单，就是出书，大量的出书，图书市场每年都会固定的销量售出，那么就会有自然增长的力量，这些就不需要我投入时间和精力了。否则就必须永远在微博和大家扯“被动收入”的蛋，而自己永远无法有被动收入。                                ,无,无,无,2020-02-28 23:07,微博 weibo.com,593,78,86
IwkGLoY27,面试绝对禁忌语：「虽然我没有经验，但是我非常愿意学习」学习能力口说无凭需要证明的，在没来面试之前其实就可以通过官网和谷歌，搜索到该公司该行业的产品，地位，财报，竞品，市场策略，以及职位，职能和各种要求，这个通过网络基本都能了解一二，就算对这个公司不熟，起码对该行业和该职位应该会有一个足够深入的了解（尤其是对应届生来说）但是如果在面试的时候完全没有体现出这些信息，同时又口口声称自己学习能力强愿意学习，也就是说口头宣誓和事实完全相反，这个时候绝对是大减分。面试答问的基本逻辑是：多做证明类阐述，坚决不做结论式阐述。也就是，不要说自己什么吃苦耐劳，学历能力强，热爱该行业该职位等等，而是应该多想想自己有哪些经历，知识储备，以及完成的项目和事例等，可以证明自己有这类能力素质。                原图                            ,http://wx1.sinaimg.cn/large/94900170gy1gccge3wczqj21hc0twab4.jpg,无,无,2020-02-28 21:50,微博 weibo.com,1310,421,107
